1,"This zoo just keeps getting better, and better. I've been to this zoo almost every other year since I was 4 years old. I'm 23 now.\n\nI'm planning another \""back to Arizona\"" trip, since I moved away from AZ for about 5 years, and missed AZ so much that I just HAD to come back. I went to the Kansas Zoo, and wow, was it HORRIBLE! There was next to nothing compared to the Phoenix Zoo. I remember going and hearing people say how Amazing it was, then after actually going to it, it made me miss and appreciate the Phoenix Zoo even more. \n\nThis place is huge, and has a really cute lay out. I don't know why so many people said it was a bad lay out, or not a good zoo. Everytime I've went, the animals were out and about. We even saw bear cubs wrestling with each other while the mother/father watched. A white bird kept saying \""hello pretty\"" to me, and \""no!\"" to my brother, hahaha.  \n\nThey now have the up close giraffe exhibit, as someone else mentioned. They never had that when I was growing up, so I'm really excited to go and see how that is.\n\nI give this zoo a 5/5 stars, because I've never once had a problem. For the people complaining about strollers, I completely agree but it's expected when people have so many kids now a days :( Makes it sort of hard for the ones that don't have kids to enjoy stuff when you have 5 kids and 3 strollers in front of you, or on your toes. \n\nThe gift shops are great! Sure, they may be a tad overpriced, but when are gift shops not over priced? Exactly.\n\nDon't forget zoo lights. I don't know of any other Zoo's that have it, but if you have a zoo with zoo lights, consider yourself lucky, and go to one immediately . If you don't have one, come to the Phoenix Zoo around Christmas time, and see the zoo lights. It's so pretty, and puts you in such a great Christmas mood. It definitely brings out the Christmas now a days, since most people don't seem to decorate or celebrate it as much, anymore =("
1,"I've been to a lot of airports and I have to say that I think Phoenix Sky Harbor Airport is probably one of the most user friendly. They need to do some work in baggage claim, with better signage and maybe see what can be done to speed up luggage delivery, but the gate areas and shopping are pretty darn good. I like parking in the garage but it's a bit pricey for me and the economy lot parking shuttles are too slow for my taste. So I either get a ride or use an off airport parking lot as they seem to be faster. if you have a long lay over, there is plenty to keep you entertained while at Sky Harbor."
1,"I love it here, and even though I'm moving across town soon, I will always continue to bring my pet cat here.  The vet is wonderful.  He's very honest and you can tell that he really loves animals.  The woman who runs the front desk is very polite and always on top of things.  They were also considerate of my financial situation and didn't try to sell me vaccines that my cat didn't need.  They were very up front about pricing.  I love it here and I'm so glad I found this place.  I trust my kitty in their hands :)"
-1,"The coffee here is atrocious. My \""latte\"" looks like someone took the government-funded chocolate milk we were fed as kids, and cut it with chalk-water. It tastes like someone forgot to remember to put the coffee grounds in the espresso machine, and all that came out was the grime residue on the inside of the pipes that got blasted off by scalding water. Then they took a huge vat of skim milk and burned the crap out of it and mixed it with water. They combined the two in my cup. I asked for less milk, hoping to be able notice some coffee flavor. But I still have a 10-oz. cup of flavorless grey water."
-1,"I hate this fucking stinky ghetto shithole. My car was broken into here in broad daylight. There's always unsavory characters lolling about, and that's just the people that work there. They roll one distrustful eye up towards you (the other obscured by emo fringe) and glare at you for even daring to disturb them. As for the people that shop here, if you stand too close, you will probably catch lice and get exposed to tuberculosis in one shot. Every time I come here, without fail, there is some sorry sack of shit at the pharmacist counter, trying to convince them they just \""lost\"" their written prescription for Vicodin, or their Percocets got \""stolen\"", all with Emmy-award winning shows of anguish and pain. So you're asking now why I even come here, and I don't blame you. I work long hours, and this is the closest 24-hour pharmacy to my humble abode. Sometimes, a girl doesn't have time to  drive to a first-world facility. What can I do, except clutch my bag extra close, scared-old-lady style, and take an extra long shower with extra disinfecting soap when I get home."
1,"I absolutely love this pizza.  This is my comparison place when I try other places and I'm still saying Nello's is better.  I've never had a bad pizza here.  Their thin crust pizza is the best and they don't overdo the sauce, so you can still taste the bread of the pizza. Of course the staff is always friendly. Bonus part is being able to have a good red wine here with the pizza. Yum."
-1,"Ordered a Bean and Cheese Burrito the other night in the drive-thru, didn't know I mistakingly ordered the Lard and Cheese Burrito. Three of the worst dollars I've ever spent.\n\nAs far as drive-thru Mexican places I've given a try in my day (and I've given a few too many a try), this might be the worst.\n\nI've yet to find a really good dirty taco shop around downtown, but the Filberto's by Glam is a lot better."
-1,"Not worth your money.  Poor service, worn interior, A/C was non-functional, THE CD PLAYER DIDN'T WORK, AND THERE WAS NO AUXILIARY JACK.\n\nThey get two start because they managed to get us from Point A to Point B without making us fear for our lives."
1,"Great culinary experience. Greg, the owner, is very personable. Enjoyed the live music and the whole warm feeling of the restaurant...great food and great wine."
1,"Wonderful! Hailing from the Midwest, I've always loved desert flora and fauna because it's so radically different from what I grew up with. A few hours at the Desert Botanical Garden really indulged my fascination. Grab a sunhat, a camera and set aside a few hours to wander the trails here. It's truly a delightful experience. Besides all the amazing plantlife, I saw myriad birds, a lizard, a jackrabbit and some other kind of tree rodent thing, though I sadly did not catch a glimpse of desert tortoise. I guess I'll just have to go back!"
1,Great service and they had what I came for. Some work boots. Rand H. and I called in first to make sure they had what we were looking for and they did indeed. Big 5 Gets my big 5 stars!
1,"We had a great experience here from start to finish. The service was exceptional and we tried one of their specialty pastas that had prosciutto, Spicy sausage and ricotta cheese. We shared a small and had leftovers for dinner the next day. Garlic bread rounded out our meal and unfortunately had no room for dessert though it looked wonderful as well. \nLove the warmth and decor of this place and hope to return sometime soon."
-1,"I met some friends here for lunch, the menu is a weird mosh of Italian, Mexican and American food....it is almost like they can't figure out what kind of restaurant they want to be. \n\nI ordered the cheese enchiladas which was probably the wrong choice at a non-Mexican restaurant, but I just wasn't feeling anything else. The two people who were with me got their food, and I was still waiting, and waiting and waiting. Finally the waitress came over and asked if anyone had been here to talk to me...isn't that her job? She said that they gave my dish to someone else by accident, so they are making me a \""fresh\"" plate. \n\nMy enchiladas finally arrive, and look like they were just slopped on the plate. i take a bite and guess what? They were barely warm! You would think that a \""fresh\"" plate would be served piping hot! I took a few bites, but by now I was over them and late for a meeting. \n\nA waitress that was different than ours brought over our check, which included my enchiladas. I told her what the problem was, but she didn't seem to speak English very well and said she would go ask someone. They did take them off the bill, but that really should have been done automatically since the other people at my table were done with their food before I even got mine! \n\nThe decor is odd too, it is like they are trying to be a sports bar, but maybe aren't sure, evidenced by the 6 plasma TVs sitting in the corner still in their boxes! \n\nIf I have a say in the matter....I won't be returning to Deemos."
1,"First off, like what Daren below me wrote, there are 2 Casey Jones's. One offers up free UFC, and this one offers up an incredible local beer selection , and some decent food to go along with it. \n\nIt's a sports bar, and it does it well. And they carry everything, including stuffed pizza sticks, nachos, and my personal favorite, fried cheese curds.\n\nYes, fried cheese curds. Balls of wonder. \n\nGo for the beer, the tv's, and trivia on Thursdays. \n\nParking is horrific."
-1,"Tried takeout yesterday. One of the worst Indian meals we have had in a long time.\n- Lamb Kabobs - undercooked and falling apart. They may have run out of time or maybe they had too many takeout orders. No excuse. A big F for this.\n- Chicken Makhni - C minus. tasted bland for what is supposed to be a very flavorful dish. Very small portion. \n- Saag Paneer - C+ The paneer tasted rubbery. Good flavor though.\n\nOne can understand, this is Charlotte and thus not a Indian food destination. But the miss on simple Kabobs clearly show a careless staff. Charlotte deserves better.\n\nIn my opinion, a waste of money."
-1,"This place is slimey as all heck & a disgrace to the KIA brand.  I chose to go to this dealership because I was under the pretense of a false trade-in promotion.  Their claimed minimum trade-in value does not pertain to the vast majority of their car lot. Their selection is extremely weak (they only carrying a handful of each model).  \n\nIn the last decade I've purchased cars from the Independence Carmax (twice), Scott Clark Toyota & Hilbush Ford.  I prefer all of them over Folger Kia."
1,"This is one of my favorite Italian restaurants that reminds me a lot of the little Italian family style restaurants you can find in little Italy and other places around NYC. I come here about 3-4 times a month to get my Italian fix:) The staff is super friendly and treats you like your family. The owner, Richard, is often there and loves to talk so get ready for a great conversation about the history of the restaurant etc!  Its a very small restaurant and seating is limited. I personally like sitting inside because its warm and cozy! There is outside seating but it looks out onto a shopping center parking lot which to me is not appealing to me at all. The food here is AMAZING! Portions are quite large and can easily be spit in half to share. They have been on the TV show Diner, Drive-ins and Dives, which is where I got my motivation to make the drive over there. I would recommend the calamari to start and/or the bruschetta, which offers 4 choices of toppings. For the main course I always get the Spagetti Neri, which is squid ink pasta with a TON of seafood. If you like seafood this is definitely the dish for you! The Bolognese is also an excellent choice. To top it off at the end of my meal I like to take a conolli, which is always made fresh and oh so yummy!"
1,"While visiting family in Mesa for the week, my husband and I decided to spend one (rare) rainy afternoon going bowling. A quick Internet search led us to AMF Lanes. Though the reviews weren't stellar, we are far from bowling alley connoisseurs so we were confident that this place would meet our needs. We were pleasantly surprised to find that it well exceeded expectations! The price was very reasonable, only $8 for all you can bowl until 5:00! The woman working the counter was extremely friendly and helpful too. Dan the bartender (and fellow northerner, Michigan to be exact but we don't hold that against him), was quick with our beers and enjoyable to talk to. He even made rounds over to the lanes to check on the bowlers and to ask if they needed anything. The place was clean, played fun music, and had a nice afternoon crowd but was not overly packed. All in all it was a fun and affordable activity and we definitely plan to return when we are back in town. Thanks AMF Mesa Lanes!"
-1,"Never been treated so poorly\n\nI went with three friends to eat at Tessaro's on a rainy Saturday evening.  I dropped them off while I parked the car.  The hostess  sat them and when she found out I was parking the car, she told them literally to \""GET UP.\""  She said they wouldn't seat them because I wasn't there.  By that time I had arrived at the table  my friends were still in shock by the utter rudeness.  Tessaro's was a Pittsburgh institution that my family had frequented for years.  Our treatment is a disgrace to its reputation"
-1,"I took my parents here because it's one of their favorite places, but I wasn't that impressed.  The service was impeccable, but the food - not much different than Outback or Texas Roadhouse."
-1,"Now I'm picky about my hair, but Mane Attractions was so bad that I walked out after about 15 minutes of watching the stylists work on other clients.\n\nI had desperately needed a haircut and walked in for a major trim and re-shaping of my layers.  First, the girl at the counter said my hair might be \""difficult\"" due to the length (it was nearly long enough to sit on at the time) and that I would probably have to stand while it was cut.  Weird, but okay.  Second, no one there knew anything about donating to \""Locks of Love,\"" and I feel like salons should be aware of things like that.  I needed a cut so I went for it anyway.\n\nI watched the two stylists while I waited for my turn.  One stylist told the client whose hair she was cutting that she was going to do something other than what they discussed because it \""wasn't looking right.\""  Ummm, okay.  The other stylist was too busy checking her phone every three seconds to notice she was yanking on her client's hair so hard with the comb that she was giving her poor client whiplash.\n\nAt that point, I just pretended like I had received an urgent text and said, \""I have to leave, so sorry \""as I bolted for the door."
1,"No alterations! Nicht!\nI have out-of-town guests and always like them to experience the wonderful food and service at the Rokerij. I was craving my favorite Carne Adovada (pork roast dish), however I usually replace the rice and beans with some of their fresh seasonal vegetables. Not this time! Apparently the kitchen can't handle changing out sides (as of a couple months ago). So had to completely switch gears and figure out a new direction very quickly as rice & beans are not my friends. \nAs expected the meal was delightful but still craving my Carne!!"
1,My family loves coming to the Mesa Cracker's for breakfast and sitting on the patio (weather permitting of course)!  We always receive such wonderful service and food!
1,"Food and service is excellent! Salsa is fresh and delicious and the guac is equally delicious with a hint of jalape\u00f1o. They must've included a bit of jalapeno in the fajita veggies in my chicken quesadillla because my mouth was craving milk.  Our server brought my hubby a free fried ice cream since it was his birthday. :)  They also have gave me 2 free dinners for buying over $30 in gift certificates.  We loved Jessie, our server!  However, they don't have jalape\u00f1o cream cheese and the women's bathroom is old and little gross.  Just go to the bathroom elsewhere."
1,"My review is on the Sprouts Sandwich Counter only.\n\nI don't shop here or at any of the locations at this point because none are in walking distance of home. \n\nBut I was in with a friend and we grabbed SANDWICHES at the counter. They were made to order and they were good!  They were so fresh too! I had the Chicken salad on Multi-grain bread. Yummy, can't wait to stop in again for one.  And the full sandwich was $2.99 ( w/o cheese). \n\nMaybe I will shop here after all from time to time."
-1,Aaaaaa-hole employees give the worst service you'll ever have. Unless you're blackout go elsewhere. They wouldn't give me a water for a dollar. $1.08. Ate the pizza dry as shit. Never again. Pizza was good though.
1,"Man, I am going to miss Krua when I move back to Washington. I was pretty convinced the Southwest just didn't understand Thai food the way the West coast did, but I've been proven wrong. I'm updating my review because I finally got the chance to eat inside. I love the decor! It's just a small hidden place but it really is worth eating inside.\n\nI started with a water and a sweet Thai iced tea. I've never had anything like it! Super sweet and served with heavy cream on top. When stirred, the whole drink turns a bright orange. It was a really nice contrast to what we ordered..\n\nPineapple fried rice. Shrimp panang curry. Tofu pad thai. Veggie spring rolls. Get ready to say the Lord's name in vain, because that's all I can really do when I eat food from here. It's just great. I love the pad thai especially because it isn't overly greasy or soupy at all. The tofu was really good, pan-fried to perfection. And I like it hot! Even at a mere 'medium' spice it was burning my palate. The veggie rolls were meatless and were made with lots of pepper counteracted by the sweet and sour sauce. Steaming hot, extra-crisp. Great big portions make for plenty of leftovers for tomorrow's lunch.\n\nThe service is quick and the man who always seems to be working is so so friendly. We got pretty cold from a breeze coming in, and he even closed the door. \n\nI don't care what you Thai purists have to say... I get around when it comes to pad thai and this place is duking it out in my heart for first."
1,At AJ's you can buy fresh baked pizza. Try it. It's honestly one of best pizza's you will ever have. \nStaff is very nice. Overall great experience.
1,"Maybe it was just lucky timing, but I walked into Cigna Urgent care at 755 E McDowell and within FIVE minutes was brought back by a nurse for some screening.  Within ten minutes, i was seen by Dr. Michael Esmay.  Everyone had great customer service and generally positive attitudes.  I was very impressed and everyone was polite with great bedside manner."
-1,"Maybe I'm spoiled, but coming from Orlando to Charlotte, going to Carowinds was an eye-opener for me.  It made me remember just how much care is put into theme parks by Disney and Universal.   They don't put a lot of effort into theming, landscaping, or guest service at Carowinds, but they do throw some rides your way.  \n\nAs rides go, the rides are okay here at Carowinds, somewhere between a carnival and the theme parks in Orlando.  The old wooden Hurler roller coaster didn't make me want to hurl, but it did make me wish I was wearing a crash helmet.  My head felt like a martini -- shaken and stirred.  Some of the other rides felt like rides I used to go on as a kid; they haven't been updated.  \n\nAs for their food options, they're not great.  We waited awhile for below average theme park fare.  And don't even get me started with the guy who wanted to run off with our credit card to ask his manager something when we wanted to buy a soda.  That was 15 minutes of my life that I'd like back.  \n\nWhat does Carowinds have going for it?  Its proximity to Charlotte and an option for something to do for a day during the summer.  Other than that, save your money and go to Orlando."
-1,"I went to Pino's recently, only to be disappointed by the owner himself. I guess I should have read the reviews on here before going, seeing as a lot of people echo the sentiments that I feel.\n\nAfter my mother sent back her extremely oversalted steak, the chef came out to \""apologize\"". It was very embarrassing how he chastised her for not enjoying her meal. He then snidely commented, as walking away, that he would \""never salt his steak again\"". I don't really take kindly to people speaking so rudely to my mother. She was very polite about sending it back and certainly didn't deserve any attitude. We had an event to attend, which we were very clear with to our waitress. So when my mother reordered another meal (a salad), which took another twenty minutes, my mom asked for it to be immediately wrapped up. The chef returned, obviously chewing to make a point, and sneered at my mother, announcing her steak that she refused to eat was actually quiet good. Well, I have never felt more embarrassed in a situation. I said he was being rude to my mother, a paying customer. He proceeded to get heated and tell me it was not his job to make people happy (!??!) and that everyone else seemed to enjoy their meal and we just had to get to the inside of the steak to appreciate it. \n\nThe drama continued when he did not have change for $100 for a $57 bill. Sorry, how can you not have $33 in change?! He ended the night by throwing our bill in a crumbled mess on the floor and walking out. \n\nOverall, embarrassing. It was an embarrassing situation for anyone to witness. Take heed of the negative comments on this site. I certainly wish I would have."
1,"No Ka Oi (#1!) plate lunch in the desert!  Lived on fresh, inexpensive plate lunch when I lived on Oahu and the Big Island, and Moki's fits the bill.  I had the Ahi Plate lunch with white rice, and a spinach salad side.  The salad was non-traditional, but oh so good!  The fish rocked, and the rice had a nice touch of salt and sugar.  Very good.  Wife had the Kahlua Pork Plate Lunch, and that was equally good.  We live near San Tan Village, but will make the trip to Moki's regularly due to the quality, quantity, and authenticity.  I told you when I was there, and I'll say it again:  YOU GUYS ROCK!!  Aloha."
1,"Celebrity is one of the better concert venues in the valley.  Sometimes the stage revolves and other times they do a 3/4 house show and it doesn't.  Either way, good place to see a show.  The bar downstairs is decent, friendly bartenders.  Dodge is probably my favorite venue but for smaller or mid sized concerts/acts this is the place."
-1,"These people were so unbelievably rude to me. They were rude on the phone, they were rude when I picked my order up. I am not going back even though the food was good, not worth being treated like you are the smallest person in the world. There are a handful of other delis very very close that are just as good.\n\nUpdate: 11/22/14\nI just saw your truck driving down 7th Street in the most reckless dangerous way. Wow, if you're going to drive like a jerk, word of advice, don't vinyl wrap your truck with your business on it!"
1,"A friend of mine and I have been going here for lunch for a while. Our tradition would include escaping from school/work on Mondays and meeting up here for lunch. The coffee is good, the pastries are great, and the food is excellent. They used to have this iced tea there (but seemed to have swapped it for something else as of late) that was unbelievable. We called it the \""Tea of Freedom.\"" It tasted like a promising adventure awaiting you just around the corner. Stop laughing! It was really damn good iced tea. But just as it came into my life, it was gone just as elusively.\n\nThe owners are accommodating and charming. On slow days we would see him sitting outside with a demitasse of espresso and reading French newspaper, only to hop to his feet when we walked in. \n\nIt does appear the prices have gone up, and they're approaching steepness for a cafe, but this is the Biltmore after all. \n\nHighlight: Don't know what to get? Ask for a recommendation. You won't be sorry."
-1,"This place is awful.  The pizza is not good, but what is worse is the people who run the place.  They screwed up my order and refused to fix it.  I told them I was going to throw it away and order from somewhere else.  And I did.  Its really too bad, they are super close to my apartment. If they would've just been nice and switched it, I'd probably order from them again just based on that alone."
1,"Sundays couldn't be sweeter without a frequent stop here at Rokerij. From their \""Hip\"" staff to their decor; it entices you with each visit. Appetizers are a must and I highly recommend taking advantage of their Sunday Happy hour. You'll be strongly convinced."
-1,"Used hotwire to find a last minute deal when traveling through Madison. We generally aim more for Country Inn or Hampton... but this was the best deal.  At check-in I was told they only had king beds left,  though the parking lot was quite empty.  When we got to the room there were no sheets for the hide-a-bed. We went to the front desk and asked for some. We were told that the security guard would bring them up. 45 minutes later (it was close to 12:30 am at this point) we had to call and remind them. \n\nThe room was pretty rough. Lots of ding marks on the doors and trims. The light over the mirror didn't work. Things were just worn out.  The bed had clearly seen better days.  Crowne gives you these silly \""relax packs\"" with aroma therapy stuff.  A good bed would do more for making me relaxed. \n\nIn general I wasn't impressed.  We'll stick with Country Inn & Hampton inns."
