1,I just wanted to give my two cent. I have been going to dawn studio for years. I like the fact that Dawn studio  is a small business phoenix az owned good for the economy..all of us. I like the classes I feel I get a great workout everytime. I do wish they had classes wtih the cool air..but then it would be call Hot Yoga..lol. I also would like to see more pilates classes. \nI met Dawn when she still had a regular job and a weight problem she has taught me more about staying focus working hard to getting in shape since she know what it take to keep it together. I would recommend Dawn classes in a heartbeat.!
1,"Great happy hour food and good drink specials. Try the Firecracker shrimp appetizer and Huckleberry Margarita, really good!!!\nGood idea after hiking Camelback mountain....\nFriendly, pleasant staff."
-1,"As a lifelong Pittsburgher, I've been to Tambellini's enough times over the years -- and I think it's still open simply because of it's location practically next door to the Benedum, and patrons who go there aren't the regular theater-goers.  I was invited to go with friends, who were old enough to remember when it was probably good.\nThe prices are *outrageously* high for the quality of the food and portions.  I had the Chicken Marsala, which was alright, but something I normally eat served out of a chafing dish at a funeral buffet. This was comparable to a catered version and the restaurant itself deserves a funeral... It's outdated and just a factory for getting people in and out and on time to the cultural events they're going to.\nThe waitress was nice enough, seemed a bit embarrassed to respond 'no' when I asked if certain menu items were fresh.  On the other hand, she disappeared quite a bit and didn't ask if we wanted any desserts -- which we probably would've if we'd been asked.\nEven though Downtown after business hours isn't the most exciting place to eat, there are other places I'll insist on going instead of back to Tambellini's."
-1,"I wish i could give this place no stars! we sat for lunch after a lunch rush there were 2 other table in the restaurant besides ours, we ordered a blt with chili and a cesar salad....1 hour latler a stale BLT and chili that looked like it had been sitting there for 2 hours comes out. I was still waiting for my cesar salad. The chili was cold and the blt bread was so hard you couldnt bite into it. When we asked to speak to the manager the waitress got very defensive... the manager came over and explained that is their food and how its made so he wasnt sure of the problem. After an argument going back and forth ensued he agreed to comp the meals. Here is the kicker haha...we were going to leave the waitress a tip because clearly it was not her fault however, she came over and asked if our problem was resolved we said yes and then she rolled her eyes and walked away. No tip for you my friend. This is not how you do business especially when there are other options BESIDES SOHO to choose from for lunch."
-1,"I wish we could have met under better circumstances but the moment I walked into your establishment I wanted to vomit.  It reeked of sweaty gym socks and vinegar and there was no room at the bar.\n\nMaybe I will come back with \""What Odor?\"" in hand and we can have a fresh beginning."
1,The food is great & the service is even better.  \n\nI highly recommend this place.
-1,"Stopped for an early dinner with my wife,she wanted to try the two for twenty special.\nAs soon as we told the server what we wanted the service went downhill. We did not order any alcohol and we were having the special so this was not going to be a big check for the server but restaruant was not busy so any check should be better than no check.  Used the kiosk to pay for meal since i couldn't get the server to come back to check on us.Discount did not show up on kiosk I shouls have been  more aware since i had heard a similar comment from another table when we came in. Server said not to worry that the amount was correct. I pushed for reciept showing what was actually being charged to ny card. server said she needed my card and would have to talk to the manager. Finally got my paper reciept with correct charges but kiosk on table showed the over charge and had not adjusted. My wife thought we were going to be billed twice for the same meal, so she has been watching the debit card account.\nThis incident killed my night and the weekend with my wife constantly checking the bank account. This incident is all that my has been talking about to her friends all weekend long, I am sure that this will continue once she gets to work tomorrow."
1,"CPK catered our playgroup event, and what a terrific job they did!  Their people were charming and all the food was delicious, especially the linguine, the Thai chicken pizzas, and the wild field greens salad with candied nuts."
-1,"Definitely overpriced for what they offered.  Took my car in to check my AC, they didn't get back to me for the whole day, and decided to fix whatever the problem was without asking me and charging me an insane about (approximately $150 more than most places).  Definitely will not go back there again."
1,"This is the resort course for the Pointe Tapatio Cliffs Hilton.  \n\nNot an easy trek by any stretch of the imagination, but nevertheless a playable course for virtually anyone.  Desert golf is great in that low-index golfers can be challenged by the requirement to play target golf.  High handicap or newer golfers should enjoy the fact that the desert conditions make it very easy to find errantly hit balls and place them back in the fairway.  (Don't try to hit off the desert dirt unless you hate your clubs.)\n\nThere are a couple difficult forced carries but as long as you pick the correct tee box, they are all manageable.  Course conditions are always immaculate.  (I've probably played here 20 times over the past 5 years.)  The greens fees are a little on the high side, but then again this is resort golf and that is to be expected.\n\nMy only complaint is the service.  The guys who work the carts need to grow up and act a little more mature.  I get tired of standing there watching towel fights or two guys arguing over who can hit a golf ball farther.  I don't know why, but this seems to have gotten worse in the past year."
1,"Definitely a must-try! The building itself isn't much to look at but the parking lot is always full and that's a great indication of yummy-ness. It caters to both meat and veggie eaters with fake chicken, duck, and beef plates. They also have mock seafood plates as well. \n\nMy friend and I went to check this place out because we had heard so much about it. She ordered the lemon grass chicken and I tried the ginger duck. Both were so tasty and we were kinda freaked out because they tasted just like the real thing. The service was excellent and kudos for the waitress who kept filling up our waters...even AFTER we paid the bill. It's reasonably priced and the food portions are perfect. We even had leftovers."
-1,"The upstairs theater is nice enough. There are a few nice semi-upscale restaurants here. It's also got a really good swanky (and somewhat hidden) bar here. \n\nSo why only 2 stars? Well, because it smells like this is where all the diarrhea in the world goes to die... especially the parking structure. If you can escape the smell though, this is a nice spot for a date. The problem with that is when you go walk her to her car, you have to try and figure out how to have a good night kiss while your nose is telling your brain that you are swimming in a septic tank.\n\nThe new Waterfront mall corridor stinks like this as well. Maybe that's where the term \""filthy rich\"" comes from. What do these people eat?"
-1,"If i could give China Chili less than one star, I would.\n\nFriends keep dragging me there because it is walking distance from their offices.  If they keep insisting on China Chili, i might have to show up too late to get lunch. I have never had a good meal there. The worst was mushu that tasted like the vegetables in it were canned."
-1,"I have to say I was a bit disappointed. I drove 40 minutes out of my way to have one of these great green chile burritos...I was at least expecting pulled beef, not beef squares.  The sauce was decent, had a good kick, but there was wayyy too much of it with no chips to eat it with? SHAME on them for no chips and salsa!!!!! For $8 there was very little amount of beef inside swimming in green chile sauce-How did they get all that green chile sauce to stay in there!? We ate it on the picnic tables outside in the 107 degree heat while we got bitten by ants.  It's a pretty sketchy neighborhood, so I would make this a lunch time experience if you must try it for yourself.  Come packin' some heat if you don't want to end up like 'boys in da hood' LOL"
-1,"So, I don't know WHY we decided to stop into this sports bar for some lunch during our Charlotte trip, oh wait, yes I do remember. It's because we were starving to death and sick of walking in the 100 degree weather. \n\nAnyway, I still regret stopping in as I'm sure there are a million better places in the area to go. The service was terrible, granted we think the guy may have been new, but it was overall awkward and just odd. I don't really want a side of 'uncomfortable' with my mushroom swiss burger. (I also don't want to be asked what kind of cheese I want on my mushroom SWISS burger). \n\nPricing was a little high, food was decent, service was pretty bad but more than anything I'm just mad at myself that I didn't do a bit more research. Definitely should have found a local lunch gem that would have satisfied my appetite and need for a great cultural experience. There's always next time."
1,"I'd have to say this is one of my favorite airports to connect though.  I've never been delayed and the food selection during layovers is decent - I recommend the burrito place. I enjoy the free wifi a lot too.\n\nThere is a shuttle that goes to the metro that will take your downtown.  It's easy to use and cheap.  I highly recommend it.\n\nThat being said, when you are flying out of PHX - give yourself LOTS of time if you have a rental car to return.  Like 2 hours to park the car at the rental place, get on the shuttle, and get over to the terminal.  I didn't give myself enough time and missed the cut off for my flight by like ten minutes and wound up with a PHX-LAS-CLT-IND red eye instead of my PHX-IND flight that I was supposed to be on. i'm still bitter about it."
-1,"After reading the other reviews, my friend and I went to try this out wanting good Tex-Mex. I was surprised how mediocre it was. I had the enchiladas (my typical go-to dish at Tex-Mex restaurants) and just found them very ordinary. Even the margarita just wasn't that flavorful. After having some other Mexican that was outstanding places like Milagro Grill earlier in the week, this was not up to par."
-1,"This is nothing disparaging about the food. The food is quite tasty and exceptional. However, the service was less than stellar. I waited 10 minutes for my dessert and another 15-20 for my check, and my water was not refilled once. It was impossible to get anyone's attention to get service which is enough to put me off and not want to come back. Personally, I don't pay good money to wait on a server, I pay to get waited on. That may make me a snot but it's what I expect when I go to a restaurant."
1,"I haven't been to many airports in my life, so of the few that I've been to, Sky Harbor is one of the better ones. And here's why: outlet stations. If you have any kind of electronic device that sometimes acts as an extra appendage, you can appreciate the sight of a row of outlets in an airport. I can't tell you how many times I've arrived at the airport, realized my cell battery was low and panicked at the thought of my phone dying before take off and not having any buffer to airplane small talk.\n\nSky Harbor is clean and efficient with helpful signage as airport signage should be. I think I've always flown out of B or C gate and the food options are pretty good-better than your standard airport cuisine. Of course the prices are airport-appropriate (see: highway robbery), but should you be stuck there for an extended period of time, the eats won't be limited to mystery meat from the golden arches. Pretty much every restaurant I saw had a bar which is great for those of us with air travel anxiety. \n\nI don't mind stopping through Sky Harbor and should I get stuck there, I think it's one of the better airports to get stuck in."
1,"Fate is a great downtown spot. The servers are down-to-earth, the food is great, and best of all, it's open late! The lack of late-night joints in this city is horribly depressing.\n\nIt's sad to read other reviews of Fate being such an awful place. True, they do take reservations which can cause some trouble with people who just walk in. Those of you who complain about having to wait outside, look at what you are dining in - a house! It's not the most spacious restaurant and if it is busy, they certainly do not have room for people to crowd the place. If there is a long wait, again - a house! There are no more than a few tables. \n\nAs far as the service goes, it is excellent. The servers are extremely down-to-earth and knowledgable. The food is great, too - I recommend the Fried Tofu Wedges (well, the tofu in general), the Pad Thai, and the Hot and Sour soup. They also have fried rice, which is awesome with shrimp. \n\nAll in all Fate is a great place. Make reservations, grab a couple close friends, check out their awesome beer list, and you're guaranteed to have a great experience."
-1,Vanilla porter and root beer pretty tasty. Rest of the beers below par.  For the price food wasn't that great either. Wouldn't come back here again
-1,"Preferred Parking's rates are way too high.  We're parking in Charlotte, people, not San Francisco.  They actually want to charge me around $140/month to park in the lot near my building.  Are you kidding me?  That's what it cost to park in Chicago (and I used to work downtown).  I'm not sure if some people's companies subsidize their parking and that's why they are willing to support these crazy rates, but it just boggles my mind.  \n\nIn addition to their bad prices, their customer service is abysmal.  \nI used them for awhile when I first moved to Charlotte (parking far away from my workspace, so I could actually afford it).  But, abruptly, Preferred Parking sold the lot I parked in, never gave me any notice but did call me right before the transfer and rudely told me to find somewhere else to park.  More confusion ensued, and I ended up severing all ties with them and found another company's lot to park in. It's even further away, but worth it to no longer have to deal with Preferred Parking's bad prices and bad customer service."
-1,Decent price on domestic pitchers. Entrees were half off but all looked mediocre. Tried the jambalaya and it was so so. Big groups of patrons led to pretty slow service.
-1,"Tried to go, they were closed an hour early with employees outside drinking. Not impressed."
1,"Helpful staff, good selection and healthy plants. My second favorite nursery and one that I frequent often."
1,I love Trader Joe's! I really like picking up unique food items at great prices! Everything has been delicious! The hummus and pita chip snack two pack is really a steal for a healthy and yummy snack! I also love the large selection of cheeses!
1,I love this place the lava taco is amazing and the carmel empenadas are a good treat.
1,"My blackberry wouldn't charge due to a loose mini USB port. I had just 2 bars left for power and it's my only phone so sending it out was not an option. It was out of warranty and I don't carry insurance on my phone. I called Sun Cellar and he quoted me a price and a wait time of 20-25min. I looked around at other repair centers and found their quotes to be 2x as much and they didn't have a tech in until the afternoon and told me it would take an hour or more.\n\nI got there and was helped right away. The repair took 10minutes (if that!). Dan was polite, pleasant, and very knowledgeable. The cost was exactly the price he quoted me on the phone. I am so grateful that he was able to help me out. The repair cost less than my deductible would have cost with insurance, certainly a fraction of what a new phone cost, and he had me operational in 10 minutes! I couldn't ask for better service!\n\nI would certainly recommend this business to anyone needing cell phone repair and will use them again!"
1,"I was surprised at how good the food was at this tiny place. I normally avoid the \""hole-in-the-wall\"" type places, but I decided to give this one a try and SO happy I did. The food was well priced and not too greasy. The ingredients taste fresh and it has that family owned feeling."
1,I sat at the outdoor bar under a straw rooftop and the March breeze cooled down the Phoenix 90-degree March heat and I truly felt like I was in Hawaii. The margaritas were S-T-R-O-N-G and the crowd was lively and fun!
-1,"Non attentive staff, VERY rude bartender. Left before getting waited on!"
1,"If you love spicy food this is the place for you. I always feel like a get great service everytime I come. I bring my family often because We always enjoys the food, spirits, and service."
1,"This is my second time here and I like it. The service was quick, delightful and considerate. They were busy for lunch and it took a while to get our rolls. The food was tasty and just enough to fill our tummies."
1,C section was very empty when we fly out on a Monday night. Security lined moved quickly and it's a pretty clean airport. The water from the filter water refill station tasted salty and gross though.
1,"I love family owned restaurants and will gladly try any place that isn't a franchise.  I was very surprised to go in on a Saturday morning and the place was bustling with activity and lots of diners, all of whom looked to be regulars and quite happy with their morning blintz or eggs.  I ordered a pumperdine bagel with lox, cream cheese and onions and it was top notch and piled high with lox.  Delicious.  Love the deli pickles, very authentic, not your normal over vinegared store brand.  \n\nI would love to go back soon, after seeing their list of smoked fish...I love a good deli with fish choices and I can't wait to also try a corned beef sandwich."
1,"Tucked away into an old central (and scary) neighbourhood, it was a bit hard  to find in the dark. Glad we did, though!\nGot a lemonade (made with fresh lemon juice), the fried chicken with cheese biscuit sandwich and split an order of bacon cheddar fries. The chicken was perfectly cooked with a crispy outer breading, thick and juicy meat inside. The biscuit was really tasty and flaky. It came with a few cubes of watermelon but I don't like melon so those went untouched. \nWe sat inside at the bar and everyone working inside was super nice and friendly. They have quite a few regulars and I could see why. The prices were a bit higher than I expected but they use totally local sourced ingredients and everything is prepared fresh so you're paying for the quality just as much as the quantity. \nAn order of cheddar bacon fries, a biscuit chicken sandwich with watermelon side, lemonade, and tip totalled to just over $21."
1,"After three visits I am hooked! Great little place. I tried this place because of a local dines deal and now keep going back. Two time everything was 100% perfect. This last time the bread on my meatball sub was just a little hard, actually really hard but the meatballs are so good that I overlooked it! I have had the lasagna which was very flavorful and lots of cheese and sauce. The appetizers are great as well as the pasta fagiolli. The canolli is a great choice for dessert. Service is always friendly and fast. Food hot and fresh. The place is small but worth the wait. The owner was asking everyone how their meals were. Nice to see him involved and taking care of customers."
1,"Again , my favorite breakfast place!!! I soo look forward to my Saturday mornings!   If it \"" ain't \"" broke don't fix it!  Lol."
1,Great food. I have never been disappointed.
-1,"We love Greek food and have eaten it all over the world - including Greece....  This wasn't all that impressive.  First clue should have been that the place was virtually empty on a Saturday night....  Calamari was mediocre - definitely had much better elsewhere.  We can make Tzatziki that is equivalent or better in quality.  Moussaka was a huge disappointment - dry, undercooked eggplant...  Best dish was marinated swordfish - but definitely not worth $18..."
1,"One of the only pizza places I get really excited to visit. It has a lot of Italian-American food...calzones, lasagna, strombolis, and they're all freaking delicious.\n\nMy favorite is the mouthwatering double-deckeroni pizza. Double pepperoni, a spicy pizza sauce, and an awesome cheese blend that sends my taste buds straight to heaven, arteries be damned. For the purists out there: Yes, we know it's not *really* Chicago style, but who cares when it's this tasty? You can always get the thin crust.\n\nThey also have an extensive beer selection. They boast 110 brews, and you can take a \""world tour\"" of beer. Basically, you can record every drink you order on a membership card, and when that's done, you get your very own witty one-liner on a plaque in the waiting area. Really cool concept, but I offer some criticisms--too many of the beers are stuff we've already had. Do I really have to drink one more of the same domestic drafts to make it? What a chore. There's another list for the various martinis they have, but unfortunately those are hit or miss.\n\nThis is a great place to stuff your face, get a nice buzz, and watch the game. Shout out to the waitress that introduced me to Leinenkugel's Sunset Wheat. She gave this review just enough of a boost to give it four stars."
-1,"Prepare to be wowed. \n\nHigh class dining in one of pittsburgh's up and coming hip neighborhoods. I thought I would try some of the world famous cuisine so I pulled up on a Thursday evening. \""Gar\u00e7on\"" I asked, \""may I try some of your french fried potatoes?\"" I was greeted with a crackled mutter as I inched my vehicle forward. I was then treated to a relaxing 15 minute wait as nobody moved in line. Perhaps it was the clientele, a 1992 minivan filled with some savvy locals. Perhaps it was the professional waitstaff, whom I could hear laughing and socializing through my window. Whatever it was, the dining experience was filled with culinary magic and spa-like service. After some deep meditation, I realized that perhaps tonight was not the best night to sample such fine delicacies so I pulled away. I cannot wait to return to this location and try my luck at trying these elusive fries. I highly recommend this palace of excellence."
-1,"Okay, I have lived in Phoenix and in LA. I have always thought LA was more expensive until my experience at Maroney's Cleaners. Holy Crap Ohla!!! I paid $7.65 for a pair of lined pants to get cleaned by them. Now, I have paid anywhere from $1.50 to $5.50 but are you kidding me $7.65. Then to top it off...I was a bit disappointed in the actual dry cleaning service because my pants were not perfect!!! So, after I was done throwing a temper-tantrum in the tahoe I then proceeded to call and text everyone I know (okay just kidding) about my frustrations. The drive up service is convenient however the price is NOT WORTH IT!!!"
-1,"I have traveled all over this wonderful country and stayed in many hotels.  This easily ranks among the worst.  The staff is rude, the room has a weird stench if the AC is not on, and the \""breakfast buffet\"" in the morning is a regimented affair with coffee canisters empty or spitting some weird, vaguely brown, lukewarm liquid. The staff will thrust a bag with unidentified contents at you if you do not wish to stay in the dirty, cluttered eating area, and tell you this is what you are \""allowed\"" to take.  \n\nClearly this establishment benefits mightily from its location, so if there is a hotelier out there reading this I suggest you look into Madison as a likely place to put a comfortable inn.  I am sure I am not the only one who would take advantage of such a alternative."
-1,"I stopped in last night for a drink with a group of friends... we were in town visiting and I had been wanting to try this place out since we walked past it on the last trip... what a disappointment.  The server was prompt to greet us and drop off drink menus, but then she failed to return to take our order for at least 20 minutes.  It would've been different if she had been slammed, but the entire time she was standing by the bar, just talking to her coworkers.  By the time she came to take our order we were ready to leave... and we should have... the martinis were not good and the server's disposition left much to be desired.  When we were ready to leave she made us feel like it was a bother to split our tabs between the five of us.  The one positive of the place was that I liked the ambiance, but it wasn't enough to make up for everything else being lackluster.  What I was hoping to be a great ending to the night turned into a dismal experience that put everyone in a bad mood."
