-1,"Eat at Fioris, they said.  Youll like it, they said.\n\nis it conveniently located on West Liberty Boulevard, this restaurant features absolutely nowhere to park on the road that is impossible to get to.\n\nWhen I called to place our order a miserable sounding me an answer the phone with the side and then said what do you need? I placed our order and he said don't come down here it's going to be at least an hour to we can get to you if my coworkers can do anything right. That was really unprofessional. Some people may think that character but really I don't care what kind of a day the person taking the pizza order is having I just want to place my order without feeling im bothering them,\n\nYou should know that you will have to illegally parked your car to pick your order up.  the place was filthy inside and it was packed full of people and total mayhem. I would never ever recommend eating in store even if the place was clean up you're still going to have people waiting to pick three orders of standing right over you. It was also about a hundred degrees in there. They also only take cash with they didn't mention and there was no sign so I was glad I had cash on hand.\n\nI knew that something was up with the pizza 13 started leaking through the lid of the pizza as we were driving it home. The bottom and the top rated with grease. How does that even happen? My friend said that's a sign of a great pizza but he is a guy and we have other eating priorities it was disgusting. You're not supposed to take a slice of pizza up out of the pizza box and have all of the toppings slide off due to thebgrease.  the only restaurant that could get away with pizza that greasy is Vincents and they are now gone..you could caulk a bathtub with the cheese that's how rubbery it was. It was disgusting. the red sauce tasted like it was ketchup with sugar added. It was gross I don't understand why anybody likes this restaurant but the poor service and the poor quality of the food is a prime example of a restaurant resting on the laurels of its legacy."
-1,"I just don't understand the appeal.  I've tried this place twice thinking that I somehow had a \""lemon\"" of a burger the first time.  And then returned a few months later.  Nope.  The smoked flavor is okay and the meat seems fresh, but where the hell is the flavor?  I can go as far as saying that I don't believe that they even season the burger with salt and pepper.  If I closed my eyes, it is possible that I wouldn't even know that it was a hamburger.  That is embarrassing.  Maybe if you're used to eating 99 cent burgers, Sysco \""meat,\"" or at chain restaurants, then you would find this to be \""amazing.\""  I've had some of the best burgers at many cities in the US and this is an embarrassment to Pittsburgh.  Go to BRGR if you want a tasty burger near Bloomfield.  On the other end of the spectrum were the sides. The sides were classics, but definitely above average, especially the home fries.  I would consider a 1 star rating if it weren't for them.  Additionally, the place is overly crowded and had a long wait during the weekend. The decor is old school and seems satisfied in it's current state.  Just like the food itself.  File this one under Legacy restaurant still living on it's past accolades."
1,"This is my go to place for a really good beef enchilada. The red sauce is always flavorful, and the combo with rice and beans will surely satisfy your cravings. Even the rice and beans are delicious, and remind me of home. I'm never afraid to just order a good ol' bean & cheese burrito. With their salsa verde, it is the perfect choice if you just want something simple. Of course, they do have carne asada, a typical staple for any Mexican food joint, and theirs is pretty darn good. I always get it as a quesadilla, and I'm always happy with the decision. Don't let their old school tables fool you, this place is full of good food!"
-1,"Not impressed. When I ordered the Oyako bowl, the conversation went something like this: \nMe: What type of sauce comes on the Oyako bowl? \nFemale employee: Chicken \nMe: Yes, I know it has chicken in it, but what type of sauce comes on the chicken and rice? \nFemale employee: Chicken sauce \nNico: Just order it Teresa \nMe: Ok, can you substitute noodles for rice, please? \nFemale employee: Puzzled look of total confusion \nMe: Repeated the above question \nFemale employee: Uhhh, no, no substitute for noodles \nNico: This is not the time to be picky Teresa \nMe: Fine (as I'm looking at the sign that states \""Substitute noodles for rice for $0.80) \n\nNow I can see why the employee was so confused. There was NO sauce in my rice bowl. It was just chicken, rice, egg, and green onions. I had to add soy when we got home and I am not a huge fan of soy. Nico raves about this place and he very much enjoyed his Teriyaki rice bowl. I will go again and try something else, and I will probably make him order for me."
-1,"This is the first time ever I wrote a bad review but I am just that frustrated with Hertz CLT.  I was nodding my head on all the negative reviews on Hertz CLT location cause that is my personal experience also.  I am a Gold Circle member but apparently it makes no difference at this location.  I got on-time Carfirmation once out of five rentals in Sept  and your name is not on the board either.  It is true the lines are super long and not unusual to wait in line at least for 20 mins or more even if you are a Gold Circle member and that you had reserved the car properly.  It is also embarrassing to drive a car to the client site, of which has dents and scratches all over.  One time the car they gave me has 67,000 miles on it and the Hertz employee wrote on the paper dents and scratches all over because there were so many.   Most of the counter employees are rude or cold and not helpful.  I asked why I don't get Carfirmation or find my name on the board, the lady just rolled her eyes and there was no apology.  It is also true you always have to wait for the shuttle.  I would see two Avis shuttle come and go and 10 or 15 mins later I will see the Hertz shuttle.  I have also completed survey and sent in complaints to Hertz but nothing has changed.  The only reason I have not switched is because of good services received at other cities and my assignment in Charlotte ends in Dec and I don't have to deal with Hertz CLT any more.\nRichard... Thanks for your response.  RR 543397190 has miles out 66,900 (9/21/14) and miles in at 67,054 (9/27)"
-1,"I don't really mind dive places because there are times that they have really good food.  The place is dated and could use updating.\n\nThe waitress was good.  I think she knew we weren't all that pleased with our food even though we told her it was good.\n\nThe food....my daughter-in-law had the shrimp scampi.  We are pros at making our own at home, but when it was served, I told her that there are variations to it.  Her first bite she made a sour face.  My son and I then tasted it...understood the face after that.  Way too much lemon juice in it, soaked in oil and not quite sure what the seasoning was, but seemed like pesto.  The pasta was overcooked and the shrimp just sort of were there. \n\nMy son and I had the fried seafood platter.  Aside from overcooked breading and soaked in grease, the oysters were raw, and the battered fish had no flavor.  The breaded shrimp tasted weird too.  Needless to say, none of us finished our food. Underneath the food, the plate had a puddle of grease. \n\nOn the upside, the coleslaw, bread, and crab cake was good.  The make and cheese was edible, but seemed to comparable to Stauffer's.\n\nThis was our first, and more than likely, our last, visit.  For a $65 dollar meal, it wasn't worth $10. ."
1,"This is a frequent dining spot for me. There are not to many options in downtown Phoenix, however this place has a great variety. I am not a sandwich gal or a fan of deli's though Paradise Bakery has a great variety on their menu to offer for all types of eaters. Everything is fresh. They have daily soup options and tasty crisp salads to go. As far as the deserts (cookies, brownies, etc) All I can say is YUMMY! \n\nThe staff is always friendly. The management team is always upbeat and greets all visitors who walk through the door. \n\nThere is indoor and outdoor seating. This place gets busy so they offer call in to go orders. \n\nFor a healthy option this is the place to go."
1,I'm pretty happy with my purchase today. I found a pair of man's sandals and looked like it's under sale. The store guy told me it was on sale last week but no longer. Then I asked if he can do me a favor to give me the sale price and he agrees. I checked out but continue shopping for something else and got about $40 other things. I then asked the check out guy if I can return that shoes and combine all the things I want to buy so that I can use a 10 off 50 coupon. He agrees with the manager's consent and did working for a while to return my shoes and combine my stuffs together.
1,"This is by far one of my favorite spots!! \n\nIt's kind of hidden near the theater area, so it can be hard to find. The inside is dark and chic. It's classy and trendy. This place is for almost everyone, there are hipsters and the \""I live in the biltmore estates\"" and just regular people. It's great! It's perfect for when you don't feel like having a wild night and just enjoying a quieter night with friends. Their drinks are Delish! And so are the appetizers! Service is awesome! Music is good!\n\nAwesome place all around!"
-1,"Do not use this dry cleaner. The staff/owner smokes in the store. There are ash trays and packs of cigarettes lying around. I had to \""air out\"" my clothes after I picked them up from Galardi's to try to get rid of the cigarette smell. YUK!"
-1,"What has happened to the East Liberty Home Depot?  It used to be my \""go-to\"" place for everything DIY, but no longer.  \n\nI stopped by yesterday to pick up about nine items, all of them basic home improvement supplies: cabinet handles, tension rods, quarter round molding, etc.  I came away with NONE of it.  Everything we wanted was OUT OF STOCK!  When I asked if I could order it and have it delivered to the store (to save the shipping costs) I was told that the items I wanted were not \""qualified\"" for delivery to the store.  \""When will the items be restocked?\""  \""Don't know.\""  \""Would it be possible to get the items delivered from another store in the region?\""  \""No, that 'messes with' our inventory controls.\""  Oh, but I was told I could haul my sorry butt out to Monroeville where the stock of everything I wanted was plentiful.  Really? \n\nThe staff I dealt with could not have cared less about helping me.  Maybe because it was a holiday (New Year's Eve).  Dunno.  Don't care.  Customer service should not ebb and flow based on the day/date.  \n\nThe East Liberty HD used to have shelves full of product and plenty of choices.  And the staff was helpful and eager to engage with customers.  No longer.  It appears that the company has given up on the location and is letting it die a slow and painful (for its customers) death.  \n\nVERY disappointing to me."
-1,"I have heard a good amount of positive reviews of this place from lots of different people. That being said, I was expecting to be wowed by their burgers, which is the reason people told me to go. \n\nHowever, when I arrived with my guest, 8:00 PM on Thursday night, I was kind of disappointed. Not only did the waitress take a good 10 minutes before she brought us water, but she was not very attentive and never checked back with us until she brought the bill. The burger was so-so with little flavor, which was very disappointing. I could also tell that a few other tables in my section were looking around waiting for their server.\n\nAll in all, I was disappointed by the quality of food as well as the service."
1,"This is just a standard TGI fridays rebranded for the baseball park.  That being said, we no longer have TGI fridays in Hawaii, so the food was a new experience for me.  I went on a Monday at noon, so as expected, there was not many people.  We were able to sit by the windows that overlook the park, which was breathtaking to me.  (Dont have a professional baseball stadium in Hawaii either) \n\nSo, in terms of the food, my Auntie and Grandparents got the endless lunch.  Around $7-8 I think.  It came with Unlimited Breadsticks, soup and salad.  Only bad thing is that the French Onion is a one-order soup, and not unlimited without a small charge.  Thats bad because I absolutely LOVE french onion soup.  But my Grandparents and Auntie loved their food.  \n\nI had the Korean Beef tacos.  Love it.  Good flavor, and rather large portion.  (TIP from my Auntie, ask for potsticker sauce on the side and pour it on the rice and/or tacos) \n\nThe customer service was great, our waitress was super friendly and conversational.  Since it was pretty much empty, we walked outside to look at the stadium from the balcony they have.  While we did that, another employee got confused and cleared away our drinks and utensils.  Our waitress noticed before we came back and replaced it all.  She also took our picture outside for us.  Shame I dont remember her name to give her recognition on here. \n\nOverall, \n\nFood- 9/10\nPrice: 7.5/10\nLocation- 10/10\nCustomer Service: 20/10\n\nThe food and everything else was great, but it was the waitresses customer service that absolutely put it over the top."
-1,"BEWARE!! \n\nI had my car serviced here. Before leaving, the Pep Boys employee who handled my payment verbally told me that my car was in good shape and had no other recommendations for maintenance, which seemed reasonable, as it was showing no signs of problems. Following the oil change, I drove home (approximately 3 miles), where the car sat for approximately one hour. I then drove from my home approximately 7 miles where the car engine was stopped for 15-20 minutes. \n\nShortly after starting my vehicle and driving less than 2 more miles, the engine temperature gauge spiked to the maximum and the engine began chugging. I immediately turned the car off and pulled to the side of the road, in an effort to avoid any further damage to my car. Then my car was towed to a more trusted shop across town. When examining my car, the mechanics at a more trusted shop found that the radiator coolant cap was left off the fill neck and was lying on top of the engine. \n\nPhotos of the cap location were taken once the hood of the vehicle was lifted (cap was not moved by the trusted mechanic); including three images showing the coolant fill neck and the cap. The other photo showed the hood liner wet from the coolant that came out. Due to the short amount of mileage that was driven, the car thankfully became operable once radiator coolant was filled and the cap placed back on. Based on the photos and a licensed mechanic's evaluation of my car, it is apparent that the Pep Boy's mechanic removed the radiator cap from my vehicle and failed to secure it back onto the radiator fill neck. However, the store manager, Jae, informed me that since I drove my car a few miles \""it must have vibrated off after service.\"" \n\n\nI may be a female, but I know that the caps have locks, AND that I have 136K miles on this car and no cap has ever \""vibrated off\"" while driving. Thanks for the advice. Really. I sent both photos, reciepts, and letters to Jae. He was unwilling to admit any fault. Go somewhere else for work on your car. Hopefully there are other shops are more helpful and honest."
1,"I have been using this clinic for over 20 years.   Being active in many different sports and outdoor activities I often have need for a chiropractor.  They are always professional, friendly and go out of their way to see me. Even adjusting me on a weekend at the Dr's home a time or two when I'd badly thrown something out."
-1,UPDATE! Received an email from the owner which was a little intimidating stated that I should remove my post. Kinda think they should improve customer service then send an email.
-1,"Always make sure to scrutinize a resturant review from a college student.\nIt's more than likely based on the cost of beers rather than food quality. \nMy sushi was warm, food was cold, and the chicken in my stir fry tasted old."
1,"I was unfortunate enough to be stranded in Phoenix a couple of years ago during a major downpour.  11pm, all flights grounded, you can imagine the airport was kind of a mess.  Most hotels were all booked up at that point, but I snagged a last minute room at the Ritz (for something like $450/night, so I must have stayed in one of the nicer rooms).  I'm not a huge fan of having to fight my luggage away from hotel staff, but that's a service many people expect.  The staff at the Ritz offer that and more... \n\nI was pretty impressed by the old world styling of the place because it felt classic instead of outdated.  Even though it was late, room service is always open, so I scarfed down a delicious burger and fries (complete with those cute little bottles of ketsup and mustard) then crashed.  My stay was short-lived, but definitely memorable."
-1,"Wow, where to begin?  We just moved to Anthem from Dallas Texas and were looking for a great pizza/Italian place to eat at, but this is NOT the place.  We entered and there were only two other  dinners in the place, one was a family of 5 and the other was a family of 3, we were a party of 2.  We were seated and told that are waitress would be with us in just a minute.  Well, that minute turned out to be about 10 minutes.  Having had time to read the menu about a dozen times while we waited, when our waitress finally did show up we were ready to order but she ask us if we wanted to put in a drink order?  Really???  So we did put in an order for 2 glasses of wine and asked for water as well.  About 10 minutes later we received our wine (very small pour indeed) and no water?  As we were waiting for our food order (I'll get to that train wreck in just a minute) we noticed that the other two occupied tables were having issues with their orders and all we could hear was the waitress consistently apologizing, we also watch as the other tables food was delivered, ONE freaken plate at a time, first one child got some breadsticks, then about 4 minutes later the other child got a salad, then about 10 minutes later the father got his order, then they apparently asked for water and it was delivered ONE glass at a time by the same server (not waiter???) then we experienced the same absolutely mind numbing food delivery, with the exception that I had ordered the 10\"" pizza (which was pretty good after a 20 minuet wait) but my wife had ordered a chicken pasta dish, which we never received.  The waitress brought the pizza and two plates and started to walk away and I ask where my wife's meal was and she looked stunned, walked away and came back and told us that she had turned in the order but the \""kitchen\"" must have misread it, but she would re-enter the order, well that was about 2 glasses of wine each and one very small pizza later, which had already taken about 55 minutes....duh!  So we simply told her to cancel the order and we would just pay for the pizza and wine and be happy to leave.  It was one of the worst dinning experiences we have ever had.  The \""manager\"" was there, tending a small bar, at which NO ONE was sitting, but he did manage to go and clean the back door glass while all of his customers were waiting for service.  It was a totally dysfunctional, totally unacceptable experience and I doubt that we will ever return, unless my wife bets me that it couldn't possible be that bad on a second visit and I might be willing to accept that \""sure bet\""!!!  Unfortunately in Anthem the dinning options are very limited and even the Legend Sports Bar (well, sort of a sports bar) is failing as it changes management???  I ordered a pizza there last  week and was told after a 15 minute wait that they had no cheese for the pizza because the whole kitchen/management team just weren't ordering any food?  Wow, what a way to make a transition in business ownership!!! Someone please help these clueless owners/managers!!"
1,"My go to place for Mexican food. Chimichangas, enchiladas and menudo are my favorites . Big portions , decent price."
1,"I love the food selection at this place!  As someone who spent many years \""across the pond\"" I've learned to appreciate good european food.\n\nMy top foodie recommendations at this store:\n\n- Torani sugar free Black Cherry syrup and CostPlus sparkling water to make your own soda\n\n- The fondue cheese packs\n\n- Heinz cream of tomato soup\n\nIf you try just these 3 things you will glimpse nirvana!"
-1,"Skip. The Enchiladas are like a bad day at a sewage treatment plant. A revolting brown sauce, inedible beef, fake cheese, and a bizarre flavor that leaves one gagging. The rice is flavorless and the chips (which came with the meal) taste days old. Hey at least the canned refried beans can't be screwed up."
-1,"It was great the last few times...\n till I found a dried piece of spinach stuck on my fork when I unwrapped the silverware, and dishes had crumbs encrusted on them."
-1,"we checked out 4 rooms just to see what it was like, moldy ceilings,  musty smells, unclean rooms, and such a huge renovation job it should be shut down or discounted by 99%! thank god hotwire gave us a refund."
-1,"Awful. The sweat panted ( hey put a little effort in to it ) crabby ( if you you think your job sucks find a different one ) ' barista' ( being able to work an espresso machine is not that much more difficult than a mr coffee) at least gave me some fodder for crappy service reviews. Lazy, dirty, and angry is no way to garner tips. I didn't drink the coffee afraid she spit in it."
1,I'm here for happy hour prices can not be beat the shrimp cocktail is out of this world the cocktail sauce will make you sit up and take notice! Service was very lack luster the waitress was more interested in talking with men at the bar then seeing if I needed more ice tea...
1,Excellent railroad shop. I use them for terrain supplies as they seem to have the best selection in SE valley.
1,"I like this palce since it's so accessible. You don't have to hike all the way up, even though you can and people do. But I always drive up and the drive is a relaxing winding mountain road that has great views of the valley. It's right in the middle of the city so it's very accessible. Sunset is absolutely beautiful here and I'm sure it's the makeout point type of destination lol. But yeah people are always taking sunset pics up here and my dog loves the trip."
-1,"I order it for my employees occasionally.  The pizza is what you expect, nothing better than OK.  They throw on an extra $1.50 for delivery charge and the drivers tell us that most goes directly to the managers pockets.  That Sucks."
1,Spectacular!\nGreat comfortable environment and delicious inexpensive food.  If you love hot dogs this is your place.  They have lots of variety but don't go overboard and mess up a simple delicious hot dog.  One thing i can never forget about this place is the soda.  Sounds peculiar I know but they mix it perfectly and shave the ice into almost powder mmmmmm.  Very nice owners who run a great business so if you like supporting local business im sure thy could use your business.   Only open for lunch but definintely beats stealing coworkers leftovers from the work fridge. I hear not so great things about their burgers but i go there for the hot dogs so I've never had that problem.  Highly Reccomended!\n\nRecommend: footlong
-1,"This was my first trip to Charlotte. I've looked up other hotels in the area and have decided upon the Omni. The Omni is very overrated. When we checked-in, they had a five day wedding celebration in progress. No bell captains available upon check-in. When we got up to the room, I was very surprised to see how outdated it was for the money. Ripped curtains, blown out light bulbs in bathroom. And most of the extra electrical outlets did not work. I had my cell phone charging, come to find out the outlet never worked. I switched it to another outlet, and, again, no charge. Upon my morning cup of coffee in the room, the mini creamers were sour. I called room service, and they never brought them up. Nor did they refresh the coffee station when they cleaned the room. No fresh creamers and two sugars for two days! I take my coffee serious. Lol. The second day in the morning starting at 7:00 AM, I was woken by a pounding sound of music coming from the courtyard. This was the ritual going on for the wedding. It continued for two hours. If the wedding was going to be honored on the lower floors, they should have put the other guests on the upper floor to avoid all the commotion. The garbage cans on site were overflowing with garbage for two days. No one took the responsibility of emptying them. We paid good money for a nice, clean, quite break. Only to have nothing but a out of date room, tons of noise, and a unclean looking surrounding. Guests should have been forewarned of the wedding festivities when booking. Although, the staff was very accommodating, they weren't on a mini vacation, we were. The only thing we were offered was free coffee or a breakfast beverage in the morning ! Also, be aware, if you don't join their rewards club, check your bill for a $9.95 a day charge for Internet. We were really disappointed in this hotel and will not be returning at all. See attached pictures."
